{
  "$schema": "https://json-schema.org/draft/2020-12/schema",
  "$id": "https://github.com/medic/cht-ai-tools/packages/agent-watchdog/schema/findings.schema.json",
  "type": "object",
  "properties": {
    "project_url": {
      "type": "string",
      "description": "Must equal the project this session was opened for."
    },
    "pass": {
      "type": "integer",
      "minimum": -9007199254740991,
      "maximum": 9007199254740991,
      "description": "1-based pass number."
    },
    "items": {
      "type": "array",
      "items": {
        "$ref": "#/$defs/item"
      }
    },
    "not_selected": {
      "type": "array",
      "items": {
        "type": "object",
        "properties": {
          "candidate_id": {
            "type": "string"
          },
          "reason": {
            "description": "Required where the candidate's severity floor is medium or high; omit it for a low floor, where the id alone records that the candidate was examined.",
            "type": "string"
          }
        },
        "required": [
          "candidate_id"
        ],
        "additionalProperties": false
      }
    },
    "changes": {
      "type": "array",
      "items": {
        "type": "object",
        "properties": {
          "item_key": {
            "$ref": "#/$defs/item_key"
          },
          "change": {
            "type": "string",
            "enum": [
              "added",
              "removed",
              "changed"
            ]
          },
          "reason": {
            "type": "string"
          }
        },
        "required": [
          "item_key",
          "change",
          "reason"
        ],
        "additionalProperties": false
      },
      "description": "Empty on pass 1. Later passes record every addition, removal or change with a reason (FR-056)."
    },
    "converged": {
      "type": "boolean",
      "description": "The model's own view; code decides convergence from the diff (FR-057)."
    },
    "notes": {
      "type": "string",
      "description": "Observations for the roll-up that are not items; may be empty."
    }
  },
  "required": [
    "project_url",
    "pass",
    "items",
    "not_selected",
    "changes",
    "converged",
    "notes"
  ],
  "additionalProperties": false,
  "title": "agent-watchdog findings (one project, one pass)",
  "description": "Structured output of an analysis pass. Identity, links and persistence are derived by code; the model never emits URLs except reference_urls that appeared in tool results.",
  "$defs": {
    "item": {
      "type": "object",
      "properties": {
        "item_key": {
          "$ref": "#/$defs/item_key"
        },
        "severity": {
          "type": "string",
          "enum": [
            "low",
            "medium",
            "high"
          ]
        },
        "evidence": {
          "type": "array",
          "items": {
            "$ref": "#/$defs/evidence"
          }
        },
        "why_now": {
          "type": "string"
        },
        "suggested_check": {
          "type": "string"
        },
        "confidence": {
          "type": "number",
          "description": "0 to 1; range checked by the gate, not the schema."
        },
        "candidate_ids": {
          "type": "array",
          "items": {
            "type": "string"
          }
        },
        "reference_urls": {
          "type": "array",
          "items": {
            "type": "string"
          },
          "description": "Each must have appeared in a tool result during this run and be on the host allow-list."
        }
      },
      "required": [
        "item_key",
        "severity",
        "evidence",
        "why_now",
        "suggested_check",
        "confidence",
        "candidate_ids",
        "reference_urls"
      ],
      "additionalProperties": false
    },
    "item_key": {
      "type": "object",
      "properties": {
        "metric": {
          "type": "string",
          "description": "A metric key collected this run."
        },
        "pattern_card": {
          "description": "Card id from the merged index, or null.",
          "type": [
            "string",
            "null"
          ]
        }
      },
      "required": [
        "metric",
        "pattern_card"
      ],
      "additionalProperties": false
    },
    "evidence": {
      "type": "object",
      "properties": {
        "window": {
          "type": "string",
          "enum": [
            "current",
            "previous_day",
            "previous_week",
            "previous_cycle",
            "trailing_14d"
          ]
        },
        "value": {
          "type": "number",
          "description": "Must equal a computed value for this metric and window."
        },
        "unit": {
          "type": "string"
        },
        "note": {
          "type": "string"
        }
      },
      "required": [
        "window",
        "value",
        "unit"
      ],
      "additionalProperties": false
    }
  }
}
