{
  "project_url": "https://gamma.example.org",
  "pass": 1,
  "items": [
    {
      "item_key": {
        "metric": "up{job=\"cht\"}",
        "pattern_card": null
      },
      "severity": "high",
      "evidence": [
        {
          "window": "current",
          "value": 0,
          "unit": "state"
        },
        {
          "window": "previous_day",
          "value": 0,
          "unit": "state"
        }
      ],
      "why_now": "The scrape target is down, so the watchdog has no fresh data for this project.",
      "suggested_check": "Open the dashboard panel and confirm the trend before paging anyone.",
      "confidence": 0.85,
      "candidate_ids": [
        "1665351b28a5",
        "9fa111520496"
      ],
      "reference_urls": []
    }
  ],
  "not_selected": [],
  "changes": [],
  "converged": false,
  "notes": ""
}
